{
  "schemaVersion": 1,
  "sceneId": "GUIDE-S14-BEAST-LOBSTER-RALLY:showcase",
  "revisionId": "GUIDE-S14-BEAST-LOBSTER-RALLY@112bdd66d2be0da8",
  "shareCode": "23456789ABCDEFGHJKMN",
  "status": "Published",
  "contentHash": "86c616c2dd23e8d57db04f32a857523f8776bc2388952ea6771832423b18dedb",
  "summary": {
    "title": "龙虾进击亡语",
    "summary": "用复生保护龙虾，以进击召唤和左侧亡语串起完整野兽阵容。",
    "archetype": "DeathrattleSummonChain",
    "difficulty": "Showcase",
    "difficultyTitle": "简单模式",
    "gameVersionId": "36.2-preview",
    "gameVersionName": "36.2",
    "hero": {
      "stableId": "TB_BaconShop_HERO_95",
      "kind": "Hero",
      "name": "格雷布",
      "imagePath": "HeroBuddyImages/heroes/TB_BaconShop_HERO_95",
      "golden": false,
      "badge": null
    },
    "activeTribes": [
      "野兽",
      "机械",
      "恶魔",
      "纳迦",
      "野猪人"
    ],
    "finalComposition": [
      {
        "stableId": "BG36_202",
        "kind": "Minion",
        "name": "美味龙虾",
        "imagePath": "CardImages/Minions/Season14/BG36_202",
        "golden": false,
        "badge": ""
      },
      {
        "stableId": "BG36_210",
        "kind": "Minion",
        "name": "囤食土狼",
        "imagePath": "CardImages/Minions/Season14/BG36_210",
        "golden": true,
        "badge": "金色"
      },
      {
        "stableId": "BG36_208",
        "kind": "Minion",
        "name": "逐亡陆行鸟",
        "imagePath": "CardImages/Minions/Season14/BG36_208",
        "golden": true,
        "badge": "金色"
      },
      {
        "stableId": "BG36_211",
        "kind": "Minion",
        "name": "啮笼鼠",
        "imagePath": "CardImages/Minions/Season14/BG36_211",
        "golden": false,
        "badge": ""
      },
      {
        "stableId": "BG36_207",
        "kind": "Minion",
        "name": "狼宝宝",
        "imagePath": "CardImages/Minions/Season14/BG36_207",
        "golden": true,
        "badge": "金色"
      },
      {
        "stableId": "BG36_208",
        "kind": "Minion",
        "name": "逐亡陆行鸟",
        "imagePath": "CardImages/Minions/Season14/BG36_208",
        "golden": true,
        "badge": "金色"
      },
      {
        "stableId": "BG36_209",
        "kind": "Minion",
        "name": "暴虐巨蝎",
        "imagePath": "CardImages/Minions/Season14/BG36_209",
        "golden": true,
        "badge": "金色"
      }
    ]
  },
  "compatibility": {
    "scenarioSchemaVersion": 3,
    "mechanicStateSchemaVersion": 2,
    "gameVersionId": "36.2-preview",
    "rulesetId": "ruleset-36.2-preview-v1",
    "rulesetRevision": 1,
    "contentSnapshotId": "embedded:0.1.0-alpha",
    "contentFingerprint": "e6eebed35fcd4b0ba16838208abd550b2e2682322bbc3b8ea7a38a28e60bfff0",
    "status": "Compatible",
    "diagnostics": []
  },
  "content": {
    "allowedActions": [
      "BuyMinion",
      "SellMinion",
      "PlayMinion",
      "MoveMinion",
      "MoveBoardMinion",
      "UseHeroPower",
      "UseRecruitAction",
      "ChooseDiscover",
      "ChooseMechanicOption",
      "UseGuideShapingSpell",
      "BeginNextTurnTransition",
      "ContinueNextTurnTransition"
    ],
    "objectives": {
      "requireFinalComposition": true,
      "requireCombatWin": true,
      "postWinChoices": [
        "FreeExplore",
        "Restart",
        "Return"
      ]
    },
    "steps": [
      {
        "order": 1,
        "actionId": "buy-scarab",
        "kind": "Buy",
        "count": 1,
        "instruction": "购买机变甲虫",
        "sourcePlacementId": "beast-scarab",
        "sourcePlacementIds": [],
        "targetPlacementId": null,
        "choiceId": null
      },
      {
        "order": 2,
        "actionId": "play-scarab",
        "kind": "Play",
        "count": 1,
        "instruction": "打出机变甲虫，为最左美味龙虾选择复生",
        "sourcePlacementId": "beast-scarab",
        "sourcePlacementIds": [],
        "targetPlacementId": "beast-lobster",
        "choiceId": "Reborn"
      },
      {
        "order": 3,
        "actionId": "sell-scarab",
        "kind": "Sell",
        "count": 1,
        "instruction": "卖出完成教学的机变甲虫",
        "sourcePlacementId": "beast-scarab",
        "sourcePlacementIds": [],
        "targetPlacementId": null,
        "choiceId": null
      },
      {
        "order": 4,
        "actionId": "play-finishers",
        "kind": "PlayFinalCards",
        "count": 3,
        "instruction": "打出两张逐亡陆行鸟和暴虐巨蝎",
        "sourcePlacementId": null,
        "sourcePlacementIds": [
          "beast-deathstrider-a",
          "beast-deathstrider-b",
          "beast-scorpion"
        ],
        "targetPlacementId": null,
        "choiceId": null
      },
      {
        "order": 5,
        "actionId": "keep-lobster-left",
        "kind": "BoardOrder",
        "count": 1,
        "instruction": "保持美味龙虾位于战队最左侧",
        "sourcePlacementId": null,
        "sourcePlacementIds": [],
        "targetPlacementId": "beast-lobster",
        "choiceId": "LeftMost"
      }
    ],
    "hints": [
      "固定种子仅用于复现本训练场景。"
    ],
    "discoveryRules": [],
    "undo": {
      "usesPerRun": 1,
      "restoreRng": true,
      "lockAfterTurnEnd": true,
      "lockAfterCombat": true,
      "lockDuringFreeExplore": true
    },
    "state": {
      "schemaVersion": 3,
      "version": "battle-test-loop-v3",
      "isStateTemplate": false,
      "mechanicStateSchemaVersion": 2,
      "name": "GUIDE-S14-BEAST-LOBSTER-RALLY@112bdd66d2be0da8#showcase",
      "savedAtRound": 10,
      "seed": 3620101,
      "phase": 1,
      "pendingTurnStartRound": 0,
      "pendingTurnResolvedCombat": false,
      "pendingTurnEndTransitionId": null,
      "pendingTurnEndOccurrenceCount": 0,
      "turnEndTransitionSequence": 0,
      "gameVersionId": "36.2-preview",
      "rulesetId": "ruleset-36.2-preview-v1",
      "rulesetRevision": 1,
      "contentSnapshotId": "embedded:0.1.0-alpha",
      "contentFingerprint": "e6eebed35fcd4b0ba16838208abd550b2e2682322bbc3b8ea7a38a28e60bfff0",
      "cardPoolPresetId": "default",
      "cardPoolPresetName": "默认方案",
      "isDefaultCardPoolPreset": true,
      "resolvedCardPool": {
        "isComplete": true,
        "activeTribes": [
          0,
          2,
          3,
          9,
          7
        ],
        "timewarpedTavernEnabled": false,
        "useHistoricalTimewarpedPool": false,
        "timewarpedPoolVersion": 0,
        "useExplicitTimewarpedPool": false,
        "enabledTimewarpedCardIds": [
          "BG34_BlackMarket_Skip",
          "BG34_Giant_001",
          "BG34_Giant_002",
          "BG34_Giant_006",
          "BG34_Giant_007",
          "BG34_Giant_008",
          "BG34_Giant_009",
          "BG34_Giant_010",
          "BG34_Giant_012",
          "BG34_Giant_015",
          "BG34_Giant_017",
          "BG34_Giant_021",
          "BG34_Giant_024",
          "BG34_Giant_027",
          "BG34_Giant_029",
          "BG34_Giant_031",
          "BG34_Giant_032",
          "BG34_Giant_034",
          "BG34_Giant_035",
          "BG34_Giant_038",
          "BG34_Giant_039",
          "BG34_Giant_040",
          "BG34_Giant_041",
          "BG34_Giant_042",
          "BG34_Giant_064",
          "BG34_Giant_065",
          "BG34_Giant_066",
          "BG34_Giant_067",
          "BG34_Giant_068",
          "BG34_Giant_069",
          "BG34_Giant_071",
          "BG34_Giant_072",
          "BG34_Giant_074t",
          "BG34_Giant_078",
          "BG34_Giant_081",
          "BG34_Giant_082",
          "BG34_Giant_088",
          "BG34_Giant_091",
          "BG34_Giant_102",
          "BG34_Giant_104",
          "BG34_Giant_105",
          "BG34_Giant_110",
          "BG34_Giant_120",
          "BG34_Giant_121",
          "BG34_Giant_201",
          "BG34_Giant_202",
          "BG34_Giant_204",
          "BG34_Giant_205",
          "BG34_Giant_206",
          "BG34_Giant_207",
          "BG34_Giant_208",
          "BG34_Giant_209",
          "BG34_Giant_210",
          "BG34_Giant_211",
          "BG34_Giant_212",
          "BG34_Giant_300",
          "BG34_Giant_302",
          "BG34_Giant_304",
          "BG34_Giant_305",
          "BG34_Giant_306",
          "BG34_Giant_309",
          "BG34_Giant_310",
          "BG34_Giant_311",
          "BG34_Giant_313",
          "BG34_Giant_314",
          "BG34_Giant_317",
          "BG34_Giant_318",
          "BG34_Giant_319",
          "BG34_Giant_320",
          "BG34_Giant_321",
          "BG34_Giant_322",
          "BG34_Giant_323",
          "BG34_Giant_324",
          "BG34_Giant_325",
          "BG34_Giant_326",
          "BG34_Giant_327",
          "BG34_Giant_328",
          "BG34_Giant_330",
          "BG34_Giant_331",
          "BG34_Giant_332",
          "BG34_Giant_333",
          "BG34_Giant_335",
          "BG34_Giant_336",
          "BG34_Giant_342",
          "BG34_Giant_360",
          "BG34_Giant_361",
          "BG34_Giant_362",
          "BG34_Giant_370",
          "BG34_Giant_376",
          "BG34_Giant_580",
          "BG34_Giant_581",
          "BG34_Giant_582",
          "BG34_Giant_583",
          "BG34_Giant_584",
          "BG34_Giant_585",
          "BG34_Giant_586",
          "BG34_Giant_588",
          "BG34_Giant_589",
          "BG34_Giant_590",
          "BG34_Giant_591",
          "BG34_Giant_592",
          "BG34_Giant_593",
          "BG34_Giant_594",
          "BG34_Giant_595",
          "BG34_Giant_596",
          "BG34_Giant_597",
          "BG34_Giant_598",
          "BG34_Giant_599",
          "BG34_Giant_601",
          "BG34_Giant_602",
          "BG34_Giant_603",
          "BG34_Giant_604",
          "BG34_Giant_605",
          "BG34_Giant_608",
          "BG34_Giant_609",
          "BG34_Giant_610",
          "BG34_Giant_618",
          "BG34_Giant_619",
          "BG34_Giant_644",
          "BG34_Giant_654",
          "BG34_Giant_656",
          "BG34_Giant_671",
          "BG34_Giant_674",
          "BG34_Giant_675",
          "BG34_Giant_676",
          "BG34_Giant_677",
          "BG34_Giant_678",
          "BG34_Giant_679",
          "BG34_Giant_680",